{
  "schema_version": "1.0",
  "correlation_id": "corr-a1b2c3d4-amd64",
  "generated_at": "2026-08-25T14:36:13Z",
  "source_commit_sha": "a1b2c3d4e5f60718293a4b5c6d7e8f9012345678",
  "workflow_run_id": "123456789",
  "bundle_arch": "amd64",
  "sbom_ref": "scripts/airgap/lib/sample-sbom.cdx.json",
  "components": [
    {
      "name": "docker.io/library/nginx",
      "version": "1.25.3",
      "component_type": "container",
      "purl": "pkg:oci/nginx?repository_url=docker.io/library/nginx&tag=1.25.3&digest=sha256:7f8d6262ad0086c07a3c3e80004d8058223ec7b25bf35b7e28b8a531d0fa4476",
      "artifact_digest": "sha256:7f8d6262ad0086c07a3c3e80004d8058223ec7b25bf35b7e28b8a531d0fa4476",
      "source_commit_sha": "a1b2c3d4e5f60718293a4b5c6d7e8f9012345678",
      "workflow_run_id": "123456789",
      "license": "Apache-2.0",
      "vulnerabilities": [
        {
          "vulnerability_id": "CVE-2023-44487",
          "severity": "HIGH",
          "pkg_name": "nghttp2",
          "installed_version": "1.52.0-1",
          "fixed_version": "1.52.0-1+deb12u1",
          "primary_url": "https://avd.aquasec.com/nvd/cve-2023-44487",
          "title": "HTTP/2 Rapid Reset Attack"
        },
        {
          "vulnerability_id": "CVE-2023-38545",
          "severity": "CRITICAL",
          "pkg_name": "curl",
          "installed_version": "7.88.1-10+deb12u1",
          "fixed_version": "7.88.1-10+deb12u4",
          "primary_url": "https://avd.aquasec.com/nvd/cve-2023-38545",
          "title": "SOCKS5 heap buffer overflow in libcurl"
        }
      ]
    }
  ]
}
